<!ELEMENT cardapio (prato+)>
<!ELEMENT prato (nome, descricao, ingredientes, preco, calorias, tempodePreparo)>
<!ATTLIST prato id ID #REQUIRED>
<!ELEMENT nome (#PCDATA)>
<!ELEMENT descricao (#PCDATA)>
<!ELEMENT ingredientes (ingrediente+)>
<!ELEMENT ingrediente (#PCDATA)>
<!ELEMENT preco (#PCDATA)>
<!ELEMENT calorias (#PCDATA)>
<!ELEMENT tempodePreparo (#PCDATA)>